<?xml version="1.0" encoding="UTF-8"?>
<users xmlns="http://www.uts.edu.au/31284/user" xmlns:xsi="http://www.w3.org/2001/XMLSchema-instance"
	xsi:schemaLocation="http://www.uts.edu.au/31284/user user.xsd">
	<user>
		<type>driver</type>
		<username>hello@world.com</username> 
		<password>lol</password>
		<firstname>Janette</firstname>
		<lastname>Chiu</lastname>
	</user>
	
	<user>
		<type>admin</type>
		<username>hello@world.com</username> 
		<password>lol</password>
		<firstname>Janette</firstname>
		<lastname>Chiu</lastname>
	</user> 
	
	<user>
		<type>driver</type>
		<username>hello@world.com</username> 
		<password>lol</password>
		<firstname>Janette</firstname>
		<lastname>Chiu</lastname>
	</user>
</users>