<?xml version="1.0" encoding="UTF-8"?>
<users xmlns="http://www.uts.edu.au/31284/user" xmlns:xsi="http://www.w3.org/2001/XMLSchema-instance"
	xsi:schemaLocation="http://www.uts.edu.au/31284/user xsd/user.xsd">
	<user>
		<type>driver</type>
		<username>trungthi.bui@student.uts.edu.au</username> 
		<password>password</password>
		<firstname>Trungthi</firstname>
		<lastname>Bui</lastname>
	</user>
	
	<user>
		<type>admin</type>
		<username>admin@uts.com</username> 
		<password>password</password>
		<firstname>Janette</firstname>
		<lastname>Chiu</lastname>
	</user> 
	
	<user>
		<type>driver</type>
		<username>janettechiu@gmail.com</username> 
		<password>password</password>
		<firstname>Janette</firstname>
		<lastname>Chiu</lastname>
	</user>
	
	<user>
		<type>driver</type>
		<username>chauanhhua@gmail.com</username> 
		<password>password</password>
		<firstname>Chau</firstname>
		<lastname>Hua</lastname>
	</user>
</users>